content,score,source,app,clean_review
Hey support team I have been using this app since 4 years and I have experienced too great by this app is totally great for online education and related. you know I updated this app at the morning and after that I opened and saw the batch's looking totally changed and feeling some worst you know like in the batch there is a section allotted and now that is too big as compared to old this before one this is feel like too big interface and also so confusing so please resolve it old one is great.,4,PlayStore,PhysicsWallah,hey support team i have been using this app since  years and i have experienced too great by this app is totally great for online education and related you know i updated this app at the morning and after that i opened and saw the batchs looking totally changed and feeling some worst you know like in the batch there is a section allotted and now that is too big as compared to old this before one this is feel like too big interface and also so confusing so please resolve it old one is great
phenomenal teachers no issues with academic stuff but doesn't work well on tablet (landscape mood) and also students' community can be improved.. we are not able to see teachers' posts. edit: new update is horrible!!,1,PlayStore,PhysicsWallah,phenomenal teachers no issues with academic stuff but doesnt work well on tablet landscape mood and also students community can be improved we are not able to see teachers posts edit new update is horrible
Best learning experience...I am commerce student and this year my first online class I take in PW ..All teachers are very kind and best teacher ever..If you ask doubt in this app your doubt clear in a moment,5,PlayStore,PhysicsWallah,best learning experiencei am commerce student and this year my first online class i take in pw all teachers are very kind and best teacher everif you ask doubt in this app your doubt clear in a moment
"sir please help me ,Update ho gaya ab bas DPP and lectures hai(yakeen 2.0 2026 ) Mai toh pdf se solve karta tha ab kese karunga.......😫 DPP kaafi time consuming hota hai 😭. Pdf se jaldi hojata tha 😭",4,PlayStore,PhysicsWallah,sir please help me update ho gaya ab bas dpp and lectures haiyakeen    mai toh pdf se solve karta tha ab kese karunga dpp kaafi time consuming hota hai  pdf se jaldi hojata tha 
"your former UI is far better than this current UI... this current UI is worst... my request to pw tech team please fix the UI issue as soon as possible... we are facing a lot of problems for this,,, is very difficult for me to find whether my lecture is completed or not it is also very difficult for me to find the lectures and many more please fix the UI...",1,PlayStore,PhysicsWallah,your former ui is far better than this current ui this current ui is worst my request to pw tech team please fix the ui issue as soon as possible we are facing a lot of problems for this is very difficult for me to find whether my lecture is completed or not it is also very difficult for me to find the lectures and many more please fix the ui
best online platform for online study there are all type of cource in this app all cource are under 5k all type of gov entrance exam,5,PlayStore,PhysicsWallah,best online platform for online study there are all type of cource in this app all cource are under k all type of gov entrance exam
best platform for any exam preparation,5,PlayStore,PhysicsWallah,best platform for any exam preparation
"Team of experienced Teachers. like this new update , best leaning platform.",5,PlayStore,PhysicsWallah,team of experienced teachers like this new update  best leaning platform
kaise ho alakh sir ji no 1 plateform hai phone lagaya Karo aap 2din baat Kiya fir phone hi nhi aaya aapka,5,PlayStore,PhysicsWallah,kaise ho alakh sir ji no  plateform hai phone lagaya karo aap din baat kiya fir phone hi nhi aaya aapka
this works like a ladder in my life to give me the next level😊,5,PlayStore,PhysicsWallah,this works like a ladder in my life to give me the next level
"I""ll fully good from my studies and the institute it the glamorous achievement for an student in his life . The connection between teachers and students is the main key point for the success . And the guardian support is an very important role in the life of any body's goals . I"" prepare for IIT Examination and I got AIR 45 .At present I am in the IIT BOMBAY . I Suggest that PW is an open platform for the study . WORK HARD ! DREAM BIG ! NEVER GIVE UP ! That's the motivation line .",5,PlayStore,PhysicsWallah,ill fully good from my studies and the institute it the glamorous achievement for an student in his life  the connection between teachers and students is the main key point for the success  and the guardian support is an very important role in the life of any bodys goals  i prepare for iit examination and i got air  at present i am in the iit bombay  i suggest that pw is an open platform for the study  work hard  dream big  never give up  thats the motivation line 
The new UI interface is worst. Unable to find PDFs. Neither it looks good nor easy to use.,1,PlayStore,PhysicsWallah,the new ui interface is worst unable to find pdfs neither it looks good nor easy to use
I am unable to get otp in WhatsApp and sms both plz help me 😭😭,1,PlayStore,PhysicsWallah,i am unable to get otp in whatsapp and sms both plz help me 
it's very helpful to all catagory students thank you alkah sir to provide as such this app,5,PlayStore,PhysicsWallah,its very helpful to all catagory students thank you alkah sir to provide as such this app
everything is good but in my planner I can't select subject due to no option,5,PlayStore,PhysicsWallah,everything is good but in my planner i cant select subject due to no option
the doubt section is not enable after the live class please do something it is the concern of so many students,1,PlayStore,PhysicsWallah,the doubt section is not enable after the live class please do something it is the concern of so many students
very best study app in India I am adarsh Kumar Chaubey saport in this app.,5,PlayStore,PhysicsWallah,very best study app in india i am adarsh kumar chaubey saport in this app
"pls switch to old layout, New one is not good old layout was way better than new one it's my request to PW team",3,PlayStore,PhysicsWallah,pls switch to old layout new one is not good old layout was way better than new one its my request to pw team
Please update it and allow landscape mode for tablets. It opens like mobile screen in tablets. Requesting to update it asap.,2,PlayStore,PhysicsWallah,please update it and allow landscape mode for tablets it opens like mobile screen in tablets requesting to update it asap
"Downloaded videos consume my internet while watching Plz fix it Love you PW whole team, there is no free batch for gate available on your application kindly provide it please 🥺",2,PlayStore,PhysicsWallah,downloaded videos consume my internet while watching plz fix it love you pw whole team there is no free batch for gate available on your application kindly provide it please 
I don't like,2,PlayStore,PhysicsWallah,i dont like
The best app I ever used for education in my phone Thank You So much to Physics Wallah Team for giving us such an impressive app ♥️,5,PlayStore,PhysicsWallah,the best app i ever used for education in my phone thank you so much to physics wallah team for giving us such an impressive app 
Good aap for education Good app for all exam Good teacher for preparation,5,PlayStore,PhysicsWallah,good aap for education good app for all exam good teacher for preparation
"Tried solving the 2nd homework question on my own. In class, I saw it was wrong but couldn’t figure out where. Went to Ask Doubt, typed my full answer, but it exceeded 600 characters (which I didn’t know). When I tried to edit, the whole thing got deleted. Is this how Physics Wallah values students’ time and effort? One doubt per slide and a tight character limit — seriously? It’s frustrating and needs to be fixed.",1,PlayStore,PhysicsWallah,tried solving the nd homework question on my own in class i saw it was wrong but couldnt figure out where went to ask doubt typed my full answer but it exceeded  characters which i didnt know when i tried to edit the whole thing got deleted is this how physics wallah values students time and effort one doubt per slide and a tight character limit  seriously its frustrating and needs to be fixed
"i am studying from arjuna batch in this app abut after watching lectures and attemptin DPPs it doesn't show any change in leaderboard and ex column and the app is too lagging when i am watching lectures , video quality auto changes and lecture stopped and lagged in between despite of better network and screen blinking occurs when i start the lecture Please resolve these issues and help the students to watch and learn smoothly",2,PlayStore,PhysicsWallah,i am studying from arjuna batch in this app abut after watching lectures and attemptin dpps it doesnt show any change in leaderboard and ex column and the app is too lagging when i am watching lectures  video quality auto changes and lecture stopped and lagged in between despite of better network and screen blinking occurs when i start the lecture please resolve these issues and help the students to watch and learn smoothly
best app. all thing are very good in appearance and teaching to good h hi,5,PlayStore,PhysicsWallah,best app all thing are very good in appearance and teaching to good h hi
some batches are missing I purchased yakeen 2.0 2025 it was completely not showing in paid and free section I purchased infinity but it is also not showing I buyed kazana it is also not showing but when I open my purchases in app it shows all I purchased successfully all payments successfull but I can't see any batch please pw team please slove it 🙏🏻 😢,1,PlayStore,PhysicsWallah,some batches are missing i purchased yakeen   it was completely not showing in paid and free section i purchased infinity but it is also not showing i buyed kazana it is also not showing but when i open my purchases in app it shows all i purchased successfully all payments successfull but i cant see any batch please pw team please slove it  
very usefull 😃,5,PlayStore,PhysicsWallah,very usefull 
The app was automatically update and the batch I purchased was no longer and there is no phone number to contact the assistant.,1,PlayStore,PhysicsWallah,the app was automatically update and the batch i purchased was no longer and there is no phone number to contact the assistant
it's an amazing platform to study,5,PlayStore,PhysicsWallah,its an amazing platform to study
Abhi Kiya changes kiye hoo yrr App me kuch samajh nhi araaa,3,PlayStore,PhysicsWallah,abhi kiya changes kiye hoo yrr app me kuch samajh nhi araaa
"good, but not every batches are good. best for jee neet and boards but not good for anything else",1,PlayStore,PhysicsWallah,good but not every batches are good best for jee neet and boards but not good for anything else
sir the dashboard area in the app where we can see our performance is not working properly I have not a single lecture backlog but then also it is showing that I have backlogs of 15-20 lectures and I have given all the tests accept one but it is showing that I have given only 6/9. Please improve it♥️,5,PlayStore,PhysicsWallah,sir the dashboard area in the app where we can see our performance is not working properly i have not a single lecture backlog but then also it is showing that i have backlogs of  lectures and i have given all the tests accept one but it is showing that i have given only  please improve it
"teachers and content, everything is alright, infact too good.... but new update is not nice, it's very confusing can't it get back to normal the lectures section, all content section... like it used to be",4,PlayStore,PhysicsWallah,teachers and content everything is alright infact too good but new update is not nice its very confusing cant it get back to normal the lectures section all content section like it used to be
it is very fantastic choice in me dream easily purchase with the help f PW,5,PlayStore,PhysicsWallah,it is very fantastic choice in me dream easily purchase with the help f pw
NEW UPDATE IS NOT GOOD...IT IS DIFFICULT TO USE IN WEB VERSION...PLEASE MAKE IT AS USUAL,1,PlayStore,PhysicsWallah,new update is not goodit is difficult to use in web versionplease make it as usual
"New app update has disturbed everything , previous one was indeed good.Though it has increase accessibility but I am not able to access my notes.",2,PlayStore,PhysicsWallah,new app update has disturbed everything  previous one was indeed goodthough it has increase accessibility but i am not able to access my notes
for studies it is one of them best app,5,PlayStore,PhysicsWallah,for studies it is one of them best app
Wonderfull app for studying,5,PlayStore,PhysicsWallah,wonderfull app for studying
this wrost app interface. and don't buy any books and accessories.,1,PlayStore,PhysicsWallah,this wrost app interface and dont buy any books and accessories
useless app take ro much time to open download video not playing without internet to much update and laging this is totally a wasted app,1,PlayStore,PhysicsWallah,useless app take ro much time to open download video not playing without internet to much update and laging this is totally a wasted app
"This app is Very helpful for poor students, and the classes are very very good and they have great skills 👑 in teaching",5,PlayStore,PhysicsWallah,this app is very helpful for poor students and the classes are very very good and they have great skills  in teaching
pw store not open,3,PlayStore,PhysicsWallah,pw store not open
this app is amazing because I wanted that I should take classes online and this platform is amazing for online classes. I don't have enough words for its feedback because the faculty who is working over here providing good studies is amazing. just some kind of problems we have to face with DPP because sometimes it doesn't open at first. so some improvements are needed with its processing. overall its perfect for those students who are serious in their studies.,5,PlayStore,PhysicsWallah,this app is amazing because i wanted that i should take classes online and this platform is amazing for online classes i dont have enough words for its feedback because the faculty who is working over here providing good studies is amazing just some kind of problems we have to face with dpp because sometimes it doesnt open at first so some improvements are needed with its processing overall its perfect for those students who are serious in their studies
worst App in Pw Store takes too much in these thing,1,PlayStore,PhysicsWallah,worst app in pw store takes too much in these thing
dpp solution show nhi kar rha jo teacher provide kiye h dpp ka 🤢🤢🤡🤡,1,PlayStore,PhysicsWallah,dpp solution show nhi kar rha jo teacher provide kiye h dpp ka 
good experience 🥰🥰🥰🥰,5,PlayStore,PhysicsWallah,good experience 
Notes section is not showing in the app . Kindly look into this problem,5,PlayStore,PhysicsWallah,notes section is not showing in the app  kindly look into this problem
extraordinary no words,5,PlayStore,PhysicsWallah,extraordinary no words
god bless you sir hmare liye aapne bhut kuch kiyaa hai. thank you sir. 👍🏻👍🏻👍🏻👍🏻👍🏻👍🏻👍🏻👍🏻👍🏻👍🏻👍🏻👍🏻👍🏻👍🏻👍🏻👍🏻👍🏻👍🏻👍🏻👍🏻💚💚💚💚💚💚👍🏻👍🏻👍🏻❤️👍🏻👍🏻❤️❤️❤️❤️❤️❤️❤️❤️❤️❤️❤️❤️❤️❤️❤️❤️❤️❤️❤️❤️❤️💚💚💚💚💚💚💚💚💚💚💚💚👍🏻👍🏻❤️👍🏻👍🏻👍🏻👍🏻👍🏻👍🏻👍🏻👍🏻👍🏻❤️❤️❤️❤️👍🏻👍🏻💚👍🏻💚💚💚💚❤️❤️❤️👍🏻💚💚💚👍🏻👍🏻💚💚💚💚💚💚💚💚💚💚💚💚👍🏻👍🏻👍🏻👍🏻💚💚💚💚💚💚💚❤️❤️👍🏻💚💚💚💚💚💚💚💚💚💚💚💚💚💚💚💚💚💚💚💚💚💚💚💚💚💚💚💚💚💚💚💚💚💚💚💚💚💚💚💚💚💚💚,5,PlayStore,PhysicsWallah,god bless you sir hmare liye aapne bhut kuch kiyaa hai thank you sir 
Very nice app. Specially physics is bestt....,5,PlayStore,PhysicsWallah,very nice app specially physics is bestt
how frustrating update why was the need of resources section also PDFs are now not available 🤮,1,PlayStore,PhysicsWallah,how frustrating update why was the need of resources section also pdfs are now not available 
IN recent updates lots of new features are added and that wonderful for studies but xp leaderboard is not working properly like if I close the lecture and reopen it after some time my xp is not added so I have to rewatch the lecture again just to score xp's,4,PlayStore,PhysicsWallah,in recent updates lots of new features are added and that wonderful for studies but xp leaderboard is not working properly like if i close the lecture and reopen it after some time my xp is not added so i have to rewatch the lecture again just to score xps
Bring back old UI,1,PlayStore,PhysicsWallah,bring back old ui
pw is one of the best learning platform as I have ever thought or seen it has many teachers there were live experiments in class and also numerous types of questions are there for practice.It is the best learning platform not only for competitive exams but also for school boards. Thanks to pw and all its faculties,5,PlayStore,PhysicsWallah,pw is one of the best learning platform as i have ever thought or seen it has many teachers there were live experiments in class and also numerous types of questions are there for practiceit is the best learning platform not only for competitive exams but also for school boards thanks to pw and all its faculties
"One thing which I don't like about the app is that if I've asked a doubt in any slide, I'm not notified if it has been answered. Same for community replies etc.",3,PlayStore,PhysicsWallah,one thing which i dont like about the app is that if ive asked a doubt in any slide im not notified if it has been answered same for community replies etc
very nice study platform,5,PlayStore,PhysicsWallah,very nice study platform
Best coaching platform in India 🪔,5,PlayStore,PhysicsWallah,best coaching platform in india 
app all function is working great except xp system despite of completion of videos the xp is not counting up,4,PlayStore,PhysicsWallah,app all function is working great except xp system despite of completion of videos the xp is not counting up
thank you for pw,5,PlayStore,PhysicsWallah,thank you for pw
The new update is worst i am confusing and difficulty while seeing classes which I completed.Many options got removed like dpp pdf . I want that so badly .It is the worst update old is better please make this update old 🙏 please alakh pandey sir 😭😭🙏🙏🙏🙏,5,PlayStore,PhysicsWallah,the new update is worst i am confusing and difficulty while seeing classes which i completedmany options got removed like dpp pdf  i want that so badly it is the worst update old is better please make this update old  please alakh pandey sir 
recent updated version of app is too much bad plz change this...,1,PlayStore,PhysicsWallah,recent updated version of app is too much bad plz change this
After recent updates I can't access old classes.,1,PlayStore,PhysicsWallah,after recent updates i cant access old classes
best learning platform for all type of exams in india,5,PlayStore,PhysicsWallah,best learning platform for all type of exams in india
Your emotions,5,PlayStore,PhysicsWallah,your emotions
this is the very best app for students of neet and jee or class 12th to 9th very helpful web for the students of this to the class and very best mental comes in this app,5,PlayStore,PhysicsWallah,this is the very best app for students of neet and jee or class th to th very helpful web for the students of this to the class and very best mental comes in this app
this is very good and helpful for every student because this platform give opportunity to those students that cannot afford for competitive exams in offline. and all the pw teachers are very good they are not only teacher but they are emotion because they always stand for every student.,5,PlayStore,PhysicsWallah,this is very good and helpful for every student because this platform give opportunity to those students that cannot afford for competitive exams in offline and all the pw teachers are very good they are not only teacher but they are emotion because they always stand for every student
very wonderful app,5,PlayStore,PhysicsWallah,very wonderful app
not able to join beta program,1,PlayStore,PhysicsWallah,not able to join beta program
pw app is very poor quality don't use user,1,PlayStore,PhysicsWallah,pw app is very poor quality dont use user
"Mai abhi recently 12th passout ki hu orr mere liye ye muskil tha apne liye best planner or guidance ko dhundh pana jo meri neet journey ko smooth kar sake jo mujhe pw ke plateform or affordable batch se mil raha hai jaha daily live lecture,dpp, doubt solution or test series join karke mujhe lagta hai ki mai v average se doctor ki journey ko aasan kar pa rahi hu ,A great thankful to u sir to supporting me when I have no any good planner ..",5,PlayStore,PhysicsWallah,mai abhi recently th passout ki hu orr mere liye ye muskil tha apne liye best planner or guidance ko dhundh pana jo meri neet journey ko smooth kar sake jo mujhe pw ke plateform or affordable batch se mil raha hai jaha daily live lecturedpp doubt solution or test series join karke mujhe lagta hai ki mai v average se doctor ki journey ko aasan kar pa rahi hu a great thankful to u sir to supporting me when i have no any good planner 
Very wonderful 😊,5,PlayStore,PhysicsWallah,very wonderful 
great platform,5,PlayStore,PhysicsWallah,great platform
just amazing,5,PlayStore,PhysicsWallah,just amazing
Best app for IIT JEE preparation. Top faculties are provided and user interface experience is also very good. But I will request ALAKH sir and PW team to remove the recent update cuz the subject section has been made less interactive in the update.,4,PlayStore,PhysicsWallah,best app for iit jee preparation top faculties are provided and user interface experience is also very good but i will request alakh sir and pw team to remove the recent update cuz the subject section has been made less interactive in the update
app update was too bad please purana bala kr do kuc smjh ni aa ra h..,2,PlayStore,PhysicsWallah,app update was too bad please purana bala kr do kuc smjh ni aa ra h
good batch for neet,5,PlayStore,PhysicsWallah,good batch for neet
best study for online,5,PlayStore,PhysicsWallah,best study for online
in this update new features are not good at all.,4,PlayStore,PhysicsWallah,in this update new features are not good at all
nice app easy to use,5,PlayStore,PhysicsWallah,nice app easy to use
It is the bestest online learning platform I really enjoy this app all teachers are great we enjoy learning through this,5,PlayStore,PhysicsWallah,it is the bestest online learning platform i really enjoy this app all teachers are great we enjoy learning through this
In new version I can't download class notes there is no option in New update please fix this problem and please return class notes download option,1,PlayStore,PhysicsWallah,in new version i cant download class notes there is no option in new update please fix this problem and please return class notes download option
landscape mode?,2,PlayStore,PhysicsWallah,landscape mode
sir please we want the old theme of pw but after the recent update your team change it and make it technically good according to new mindset but old is our emotion don't ruin it sir please 🙏🙏,2,PlayStore,PhysicsWallah,sir please we want the old theme of pw but after the recent update your team change it and make it technically good according to new mindset but old is our emotion dont ruin it sir please 
BEST EDUCATIONAL PLATFORM.......IGNORING WEBSITE ISSUES. TEACHERS ARE EXCELLENT. REALLY HELPFUL FOR MY PREPARATION.,5,PlayStore,PhysicsWallah,best educational platformignoring website issues teachers are excellent really helpful for my preparation
no doubt best app for study 👍,5,PlayStore,PhysicsWallah,no doubt best app for study 
it's the best platform for students to study at a very friendly coast .,4,PlayStore,PhysicsWallah,its the best platform for students to study at a very friendly coast 
"🫶🏻I am preparing for NDA from PW, the study is very good, there are really good teachers here",5,PlayStore,PhysicsWallah,i am preparing for nda from pw the study is very good there are really good teachers here
It's help in study very much,3,PlayStore,PhysicsWallah,its help in study very much
best out of any coaching I am glad to take neev batch and i scored 98/100,5,PlayStore,PhysicsWallah,best out of any coaching i am glad to take neev batch and i scored 
sir this app is amazing for study but in this update you have removed the option of view all content this option helps us to see that what lecture is uploaded next that's why please give that option of view all content plsss sir this update is best and it will become better if you add that feature also,5,PlayStore,PhysicsWallah,sir this app is amazing for study but in this update you have removed the option of view all content this option helps us to see that what lecture is uploaded next thats why please give that option of view all content plsss sir this update is best and it will become better if you add that feature also
