content,score,source,app,clean_review
When you select the offline course the faculty is worst as they give no holidays and they talk to you softly before admission but after admission the faculty is rude especially in the southern states branches. If you get low marks they demotivate you instead of giving motivation.,1,PlayStore,Vedantu,when you select the offline course the faculty is worst as they give no holidays and they talk to you softly before admission but after admission the faculty is rude especially in the southern states branches if you get low marks they demotivate you instead of giving motivation
this app is very good teachers are very polite and friendly 10/10 wort it app Great! 😊 thnks,5,PlayStore,Vedantu,this app is very good teachers are very polite and friendly  wort it app great  thnks
"bad app that I use don't purchased any course, because it didn't fullfilling their conditions",1,PlayStore,Vedantu,bad app that i use dont purchased any course because it didnt fullfilling their conditions
useful for vedantu student,5,PlayStore,Vedantu,useful for vedantu student
good teachers,4,PlayStore,Vedantu,good teachers
Great application 👍🏻,5,PlayStore,Vedantu,great application 
this is such a wonderful app for jee aspirants like me it is very budget friendly it is actually helps very much for my jee preparation,5,PlayStore,Vedantu,this is such a wonderful app for jee aspirants like me it is very budget friendly it is actually helps very much for my jee preparation
it's very helpful for me.... teaching method is very helpful and good,5,PlayStore,Vedantu,its very helpful for me teaching method is very helpful and good
Good app for free learning,5,PlayStore,Vedantu,good app for free learning
amazing really helpful for future leaders,5,PlayStore,Vedantu,amazing really helpful for future leaders
four stars is because u changed the teacher soo suddenly without valid reasons 😭 otherwise the app and the course is perfect,4,PlayStore,Vedantu,four stars is because u changed the teacher soo suddenly without valid reasons  otherwise the app and the course is perfect
excellent material,5,PlayStore,Vedantu,excellent material
Great app for learning & competitive exams,5,PlayStore,Vedantu,great app for learning  competitive exams
a great platform to study joined the DNA batch and my skills are improving neet journey there no lag I am so happy to study in vedantu,5,PlayStore,Vedantu,a great platform to study joined the dna batch and my skills are improving neet journey there no lag i am so happy to study in vedantu
this is the best app for class 6th,5,PlayStore,Vedantu,this is the best app for class th
My son installed it on his phone said it really helped him😊.,5,PlayStore,Vedantu,my son installed it on his phone said it really helped him
It is a good app for learning,5,PlayStore,Vedantu,it is a good app for learning
I have one small problem. That is I need NCERT book based worksheets for all subjects for 6th standard,4,PlayStore,Vedantu,i have one small problem that is i need ncert book based worksheets for all subjects for th standard
very good all teacher are good and all concepts are crystal clear,5,PlayStore,Vedantu,very good all teacher are good and all concepts are crystal clear
good learning point,4,PlayStore,Vedantu,good learning point
bugs shi kardo yrrr 2 saal se chala rha hoon ise par shi ni kar paa rhe,1,PlayStore,Vedantu,bugs shi kardo yrrr  saal se chala rha hoon ise par shi ni kar paa rhe
very useful for IPE and JEE preparation,4,PlayStore,Vedantu,very useful for ipe and jee preparation
it's a very good app for studying 📖 you should definitely go for this,5,PlayStore,Vedantu,its a very good app for studying  you should definitely go for this
"nice app for students to learn. but, it would be if the App will be available on Google TV",4,PlayStore,Vedantu,nice app for students to learn but it would be if the app will be available on google tv
"please do something that optimize the app to perform well during classes, app is very slow and should be more faster and smooth to function well.",1,PlayStore,Vedantu,please do something that optimize the app to perform well during classes app is very slow and should be more faster and smooth to function well
"this good, it priorities the feedback and teacher are friendly and good, provide notes etc...",5,PlayStore,Vedantu,this good it priorities the feedback and teacher are friendly and good provide notes etc
it is helpful,5,PlayStore,Vedantu,it is helpful
notes provided helps very much for competative exam,5,PlayStore,Vedantu,notes provided helps very much for competative exam
an mind-blowing app for students,5,PlayStore,Vedantu,an mindblowing app for students
"good many sample papers are available that are very useful for us we can able to know how the questions will be in public exams so we can able to prepare according to that, very good app",5,PlayStore,Vedantu,good many sample papers are available that are very useful for us we can able to know how the questions will be in public exams so we can able to prepare according to that very good app
"this app is soo good And the best thing of this app is that it provides soo good, easy and understandable revision notes that's soo good👍. Love this app ❤ and also those brilliant teachers ❣️",5,PlayStore,Vedantu,this app is soo good and the best thing of this app is that it provides soo good easy and understandable revision notes thats soo good love this app  and also those brilliant teachers 
I don't know what to say but it's actually really AMAZING 😍,5,PlayStore,Vedantu,i dont know what to say but its actually really amazing 
its a very good app i often use this app for my doubt solving and this helped me a lot for my iit preparation,5,PlayStore,Vedantu,its a very good app i often use this app for my doubt solving and this helped me a lot for my iit preparation
excellent study super couching in jee IIT best in vedhathu,5,PlayStore,Vedantu,excellent study super couching in jee iit best in vedhathu
nice app for online study,3,PlayStore,Vedantu,nice app for online study
good experience in learning,5,PlayStore,Vedantu,good experience in learning
marvellous,5,PlayStore,Vedantu,marvellous
good app but sum problem dpp not reattempt,5,PlayStore,Vedantu,good app but sum problem dpp not reattempt
superb app for middle class students to achieve or crack the course jee and EAPCET,5,PlayStore,Vedantu,superb app for middle class students to achieve or crack the course jee and eapcet
it's very helpful to me to learn subject and it was simple and easy,5,PlayStore,Vedantu,its very helpful to me to learn subject and it was simple and easy
"best learning app h batches k teachers bhut hardworking h, content bhi bhut accha h, aur ye app regularly improve hota ja rha h🤞🤞😊",5,PlayStore,Vedantu,best learning app h batches k teachers bhut hardworking h content bhi bhut accha h aur ye app regularly improve hota ja rha h
it's very good app it help for cracking neet,5,PlayStore,Vedantu,its very good app it help for cracking neet
good and nice,4,PlayStore,Vedantu,good and nice
Very inconvenient for students...they didn't deliver the study material and they claimed that they already delivered because of them I have to struggle a lot 😭😭😭😭 they didn't care about the inconvenient of students they only care for their personals achievement and they just want money 😭😭😭 they are scammers i don't want to recommend any other person to join the class online because of them I have to go through so much hard time.... if someone reading my opinion please stay away ........,1,PlayStore,Vedantu,very inconvenient for studentsthey didnt deliver the study material and they claimed that they already delivered because of them i have to struggle a lot  they didnt care about the inconvenient of students they only care for their personals achievement and they just want money  they are scammers i dont want to recommend any other person to join the class online because of them i have to go through so much hard time if someone reading my opinion please stay away 
it's very informative for me to learn for here the classes are nice and the teachers are skilled I learned all my school topics for here and got 100s in both science and maths in the SSC public exams 1th class,5,PlayStore,Vedantu,its very informative for me to learn for here the classes are nice and the teachers are skilled i learned all my school topics for here and got s in both science and maths in the ssc public exams th class
I hope I teach clearly,5,PlayStore,Vedantu,i hope i teach clearly
super app for preparation,5,PlayStore,Vedantu,super app for preparation
This is very good app for a student,5,PlayStore,Vedantu,this is very good app for a student
very good app for students only,5,PlayStore,Vedantu,very good app for students only
everything is there like notes and classes but some subjects are not there it is awesome app,4,PlayStore,Vedantu,everything is there like notes and classes but some subjects are not there it is awesome app
I like the all teachers and their teaching,4,PlayStore,Vedantu,i like the all teachers and their teaching
mind blowing teachers,5,PlayStore,Vedantu,mind blowing teachers
"Useless, App asked me to login ,I completed my signup process tp download NCERT solutions, whenever I tried to download it's showing or advertising for there demo classes not downloading process just again and again demo ,etc advertisement. It annoyed me a lot and compelled me to write this poor review.",1,PlayStore,Vedantu,useless app asked me to login i completed my signup process tp download ncert solutions whenever i tried to download its showing or advertising for there demo classes not downloading process just again and again demo etc advertisement it annoyed me a lot and compelled me to write this poor review
"Love the VEDANTU it helps in growth in study and the best features is that it has its own revision notes, important questions, formula cheat sheet or etc you will find these features in study material",5,PlayStore,Vedantu,love the vedantu it helps in growth in study and the best features is that it has its own revision notes important questions formula cheat sheet or etc you will find these features in study material
very good 👍 app for students with many good features really loved it 🥰🥰🥰,5,PlayStore,Vedantu,very good  app for students with many good features really loved it 
amazing 😇😇😇😇😇,5,PlayStore,Vedantu,amazing 
Best classes.,5,PlayStore,Vedantu,best classes
it's really useful,5,PlayStore,Vedantu,its really useful
"excellent , fantastic ,superb,awesome and👍👋",5,PlayStore,Vedantu,excellent  fantastic superbawesome and
Excellent App,5,PlayStore,Vedantu,excellent app
best app for class 11th,3,PlayStore,Vedantu,best app for class th
"Hellow My Name is Kartik,Really it is a nice app earlier I was thinking that Physics Wallaha will be good but it was too expensive i didn't how pw teach ,but vedantu has good customer support and a personal mentor for the students and test ,quiz,and very cheap courses 🔥🔥🔥Thank You!!🔥🔥🔥",5,PlayStore,Vedantu,hellow my name is kartikreally it is a nice app earlier i was thinking that physics wallaha will be good but it was too expensive i didnt how pw teach but vedantu has good customer support and a personal mentor for the students and test quizand very cheap courses thank you
vedantu is just perfect which can provide you every solution of your problem. I really like vedantu,5,PlayStore,Vedantu,vedantu is just perfect which can provide you every solution of your problem i really like vedantu
I really love Vedantu a lot.... My parents always say that school teacher or physical tuition teacher won't help u that much that u r lucky to have Vedantu that helps u!! 24/7 doubt solving application that helps u get ur doubt solved in minutes.... The master teachers are great... Everything is just Gr8!!!,5,PlayStore,Vedantu,i really love vedantu a lot my parents always say that school teacher or physical tuition teacher wont help u that much that u r lucky to have vedantu that helps u  doubt solving application that helps u get ur doubt solved in minutes the master teachers are great everything is just gr
its network problem,2,PlayStore,Vedantu,its network problem
trying to score but let's see,5,PlayStore,Vedantu,trying to score but lets see
"I got good experience in vedantu, questioning skill is very attractive and it is important to improve knowledge, in explaining the lesson language is important they used simple English words towards the children to explore the concepts. Thank you 👍 vedantu",5,PlayStore,Vedantu,i got good experience in vedantu questioning skill is very attractive and it is important to improve knowledge in explaining the lesson language is important they used simple english words towards the children to explore the concepts thank you  vedantu
"fraud and cheater app, teacher was less for teaching and psychopath to suck energy of child and parents",1,PlayStore,Vedantu,fraud and cheater app teacher was less for teaching and psychopath to suck energy of child and parents
supper and I enjoyed learning ♥️♥️♥️,5,PlayStore,Vedantu,supper and i enjoyed learning 
it's so nice I enjoyed the vedantu classes and learned alot,5,PlayStore,Vedantu,its so nice i enjoyed the vedantu classes and learned alot
it was a good platform for children to achieve their goals..Notes and clear explanation are easy for everyone,5,PlayStore,Vedantu,it was a good platform for children to achieve their goalsnotes and clear explanation are easy for everyone
very useful,5,PlayStore,Vedantu,very useful
"it is giving us its own notes in better way and there is no free online classes the cost for online classes and their own book materials is very high,most of the free videos are available only in Hindi",3,PlayStore,Vedantu,it is giving us its own notes in better way and there is no free online classes the cost for online classes and their own book materials is very highmost of the free videos are available only in hindi
This app is valuable for students,5,PlayStore,Vedantu,this app is valuable for students
it help me to complete note as well as I also preparing for my board so it also help me in that,4,PlayStore,Vedantu,it help me to complete note as well as i also preparing for my board so it also help me in that
it is very useful app for every student and I liked it very much 😊,5,PlayStore,Vedantu,it is very useful app for every student and i liked it very much 
superrrrrrr😍😍😍😍🥰🥰🥰😚,5,PlayStore,Vedantu,superrrrrrr
Great app.,5,PlayStore,Vedantu,great app
Really a great app and I loved it and the faculty and quick response is too good i appreciate it,5,PlayStore,Vedantu,really a great app and i loved it and the faculty and quick response is too good i appreciate it
this app provides everything a student needs,5,PlayStore,Vedantu,this app provides everything a student needs
"I really love vedantu a lot.I learned a lot of things through this app.It is a best teaching app for all students in India .Thank you vedantu!We,the students of India love you very much",5,PlayStore,Vedantu,i really love vedantu a loti learned a lot of things through this appit is a best teaching app for all students in india thank you vedantuwethe students of india love you very much
nice study and test notes is very good,5,PlayStore,Vedantu,nice study and test notes is very good
it was anice program to learn in easiat way,5,PlayStore,Vedantu,it was anice program to learn in easiat way
Thank u vedantu i will definitely get 470 + ib 10 th board with the help of u guys,5,PlayStore,Vedantu,thank u vedantu i will definitely get   ib  th board with the help of u guys
this app is the best app,5,PlayStore,Vedantu,this app is the best app
superb study material 👍👍👍👍👍👍,5,PlayStore,Vedantu,superb study material 
ok thanks for your support,5,PlayStore,Vedantu,ok thanks for your support
I love this app a lot .It's very helpful .The teachers are good. Thank you,5,PlayStore,Vedantu,i love this app a lot its very helpful the teachers are good thank you
good educational app,5,PlayStore,Vedantu,good educational app
useful for students,4,PlayStore,Vedantu,useful for students
want to other subjects and it's providing study materials also that awesome 👍 want to create a intro for the new users,4,PlayStore,Vedantu,want to other subjects and its providing study materials also that awesome  want to create a intro for the new users
very good app for students help it's is useful app..... my son learn and understands easily ...Tq vedantu,5,PlayStore,Vedantu,very good app for students help its is useful app my son learn and understands easily tq vedantu
very bad experience from vedantu store. very bad coustomer care service. I ordered neet advance book but not deliver on time even the book imhas not been shipped yet,1,PlayStore,Vedantu,very bad experience from vedantu store very bad coustomer care service i ordered neet advance book but not deliver on time even the book imhas not been shipped yet
very good classes,5,PlayStore,Vedantu,very good classes
It is a nice learning app to learn more about the topic,5,PlayStore,Vedantu,it is a nice learning app to learn more about the topic
very amazing app 😍💘,5,PlayStore,Vedantu,very amazing app 
vedantu is a best online education platform for jee mains+advance,5,PlayStore,Vedantu,vedantu is a best online education platform for jee mainsadvance
giving free very much,5,PlayStore,Vedantu,giving free very much
very comfortable,5,PlayStore,Vedantu,very comfortable
this was the first app where I can find easily notes but the quality of the notes should be increased they have only minimum knowledge,3,PlayStore,Vedantu,this was the first app where i can find easily notes but the quality of the notes should be increased they have only minimum knowledge
this app is very helpful to students daily live class with best experienced teachers this aap is also be teaching about government exams like iit jee ssc etc,3,PlayStore,Vedantu,this app is very helpful to students daily live class with best experienced teachers this aap is also be teaching about government exams like iit jee ssc etc
Nice app ☺️☺️💯💯,5,PlayStore,Vedantu,nice app 
amazing worth very much,5,PlayStore,Vedantu,amazing worth very much
"very bad service, I order a book 8 days ago book not shipped, complain not recived, not trust this app this this hang you",1,PlayStore,Vedantu,very bad service i order a book  days ago book not shipped complain not recived not trust this app this this hang you
Now only I started to use vedantu and I am really happy I love the app try panuga ...✨️,5,PlayStore,Vedantu,now only i started to use vedantu and i am really happy i love the app try panuga 
i love veadantu,5,PlayStore,Vedantu,i love veadantu
"I am having problem like using Vedantu in landscape mode on my tablet, it always try to be in portrait mode.",4,PlayStore,Vedantu,i am having problem like using vedantu in landscape mode on my tablet it always try to be in portrait mode
very very useful app. Thk u v.much.,5,PlayStore,Vedantu,very very useful app thk u vmuch
The worst institute to work with. in vedantu the local managers are goondas these fellows don't know how to respect lady staff. due to these local fellows vedantu had become the worst institute in cities. these local managers don't sanction leaves to ladies as per vedantu. students just leave vedantu and join other institutions. idiots manage vedantu. any teacher pls don't join for job in vedantu and students also do not join in vedantu. no teacher & student relationship.,1,PlayStore,Vedantu,the worst institute to work with in vedantu the local managers are goondas these fellows dont know how to respect lady staff due to these local fellows vedantu had become the worst institute in cities these local managers dont sanction leaves to ladies as per vedantu students just leave vedantu and join other institutions idiots manage vedantu any teacher pls dont join for job in vedantu and students also do not join in vedantu no teacher  student relationship
"Best app in all, the app. Very good app. Nice to learning Best app best best best best app",5,PlayStore,Vedantu,best app in all the app very good app nice to learning best app best best best best app
good platform for study,5,PlayStore,Vedantu,good platform for study
"worst platform ever I used till now I recommend everyone not to come here false promises are done no student support regarding your bach, technical support are given only dates and are given. I would like to request vedantu please learn from others platform how to be considered about their students and their problems 😞 🙏",1,PlayStore,Vedantu,worst platform ever i used till now i recommend everyone not to come here false promises are done no student support regarding your bach technical support are given only dates and are given i would like to request vedantu please learn from others platform how to be considered about their students and their problems  
From my childhood I searched these kind of teachers for explanation . Finlay i found for my daughter. Thank you Vedantu Masters. God bless you all,5,PlayStore,Vedantu,from my childhood i searched these kind of teachers for explanation  finlay i found for my daughter thank you vedantu masters god bless you all
useful app,5,PlayStore,Vedantu,useful app
it was very useful for my daughter ☺️,5,PlayStore,Vedantu,it was very useful for my daughter 
very good for future,5,PlayStore,Vedantu,very good for future
it's just amazing app for students..it has plenty of material..I loved it very much,5,PlayStore,Vedantu,its just amazing app for studentsit has plenty of materiali loved it very much
very gooooooooooooooood,5,PlayStore,Vedantu,very gooooooooooooooood
I love it 🤩❤️❤️🤩,5,PlayStore,Vedantu,i love it 
This app is asking otp,1,PlayStore,Vedantu,this app is asking otp
Nice app but my problem is half solve not full,5,PlayStore,Vedantu,nice app but my problem is half solve not full
super learning apps ❣️❣️❣️❣️❣️❣️❣️❣️❣️,5,PlayStore,Vedantu,super learning apps 
"it is excellent for JEE mains & advance students as well as EAMCET,VITEEE, BITSAT etc ..",5,PlayStore,Vedantu,it is excellent for jee mains  advance students as well as eamcetviteee bitsat etc 
unbelievable teacher's teaching level,5,PlayStore,Vedantu,unbelievable teachers teaching level
very helpfull,5,PlayStore,Vedantu,very helpfull
good learning app for students especially for neet and jee student,5,PlayStore,Vedantu,good learning app for students especially for neet and jee student
"In simple words,best learning app in Tamil",5,PlayStore,Vedantu,in simple wordsbest learning app in tamil
This is best 👌,5,PlayStore,Vedantu,this is best 
this app is very good iam student i like this app ☺️☺️ thanks,5,PlayStore,Vedantu,this app is very good iam student i like this app  thanks
it's very good for students,5,PlayStore,Vedantu,its very good for students
so help full,5,PlayStore,Vedantu,so help full
excllent no words,5,PlayStore,Vedantu,excllent no words
it's a good for learning,3,PlayStore,Vedantu,its a good for learning
"very poor application of Vedantu. rescheduling slots of classes not visible, even if slots are open and showing in laptop. mobile app is not at all upto the mark and need to be improvised a lot. it is always not easy to have access to laptops for doing stuff. so mobile apps are very necessary.",1,PlayStore,Vedantu,very poor application of vedantu rescheduling slots of classes not visible even if slots are open and showing in laptop mobile app is not at all upto the mark and need to be improvised a lot it is always not easy to have access to laptops for doing stuff so mobile apps are very necessary
very very good 💯😊,5,PlayStore,Vedantu,very very good 
It was very wonderful and very useful to students who are really want to get a seat in JEE,5,PlayStore,Vedantu,it was very wonderful and very useful to students who are really want to get a seat in jee
I really like it and this app gave me an best experience in test,5,PlayStore,Vedantu,i really like it and this app gave me an best experience in test
Good platform for jee students,5,PlayStore,Vedantu,good platform for jee students
This app is very useful for neet preparation 👍,5,PlayStore,Vedantu,this app is very useful for neet preparation 
best study platform,5,PlayStore,Vedantu,best study platform
"I get very much help from vedantu ,and I just loved with vedantu",3,PlayStore,Vedantu,i get very much help from vedantu and i just loved with vedantu
very useful app 👌 👍 I'm rating this app 10 on 10,5,PlayStore,Vedantu,very useful app   im rating this app  on 
"Once upon a time, this company used to be great but now it's a ghost town. It's all great until you pay then your nightmare starts. I registered my kid for English super stars group course. everything went smooth till their refund phase passed. they will assign mentor, relationship manager bla bla bla. they don't exist or atleast have no interest in replying back. main support email vcare is equally poor, no one bothered to reply. never sent any physical material. technical issues. avoid this",1,PlayStore,Vedantu,once upon a time this company used to be great but now its a ghost town its all great until you pay then your nightmare starts i registered my kid for english super stars group course everything went smooth till their refund phase passed they will assign mentor relationship manager bla bla bla they dont exist or atleast have no interest in replying back main support email vcare is equally poor no one bothered to reply never sent any physical material technical issues avoid this
Vedantu Improving JEE Mains exam,5,PlayStore,Vedantu,vedantu improving jee mains exam
