content,score,source,app,clean_review
You deserve this,1,AppStore,Unacademy,you deserve this
Poor organisation with big VC raised money . All they are looking for is the fleece without providing proper education .,1,AppStore,Unacademy,poor organisation with big vc raised money  all they are looking for is the fleece without providing proper education 
Vote for educated and support the one who promotes literacy..,1,AppStore,Unacademy,vote for educated and support the one who promotes literacy
Karan sir…,1,AppStore,Unacademy,karan sir
Stop licking boots.,1,AppStore,Unacademy,stop licking boots
हर हर मोदी घर घर मोदी 🚩,1,AppStore,Unacademy,      
"Unacademy is an education platform that is deeply committed to imparting poor quality education. To do this it  have to place a strict Code of Conduct for all their members like #RomanSaini with the intention of ensuring that it’s  learners have access to unbiased knowledge. 

Unacademy learners are at the centre of everything They do. The Social Media is not a place to share personal opinions and views as they can wrongly influence them. In the current situation, They Have to take action on its holders as breach of the Code of Conduct. 
Iam Uninstalling Unacademy 
#UninstallUnacademy !!",1,AppStore,Unacademy,unacademy is an education platform that is deeply committed to imparting poor quality education to do this it  have to place a strict code of conduct for all their members like romansaini with the intention of ensuring that its  learners have access to unbiased knowledge unacademy learners are at the centre of everything they do the social media is not a place to share personal opinions and views as they can wrongly influence them in the current situation they have to take action on its holders as breach of the code of conduct iam uninstalling unacademy uninstallunacademy 
You people are just spineless,1,AppStore,Unacademy,you people are just spineless
Uninstall this app,1,AppStore,Unacademy,uninstall this app
Never going to use it again,1,AppStore,Unacademy,never going to use it again
"Irony that your app was made to educate people. But when your teacher literally tried telling the student to vote for someone “educated”, you fire him. 

What’s your agenda bro? 1 star take it on your face",1,AppStore,Unacademy,irony that your app was made to educate people but when your teacher literally tried telling the student to vote for someone educated you fire him whats your agenda bro  star take it on your face
Please don’t trust and waste time,1,AppStore,Unacademy,please dont trust and waste time
Waste of money,1,AppStore,Unacademy,waste of money
Morally bankrupt,1,AppStore,Unacademy,morally bankrupt
Don’t let them teach your children…they don’t have a voice of their own how will they give a voice to your child. Think about it. A slave mind set is all they have.,1,AppStore,Unacademy,dont let them teach your childrenthey dont have a voice of their own how will they give a voice to your child think about it a slave mind set is all they have
"For hurting freedom of speech by karan sangwan, may your company also get sacked from somewhere. 
Didn’t expect this from a educational platform. 
Creepy bootlickers",1,AppStore,Unacademy,for hurting freedom of speech by karan sangwan may your company also get sacked from somewhere didnt expect this from a educational platform creepy bootlickers
#UninstallUnacadmy Are you really an educational institution when you fire someone for saying that ‘education’ is necessary to lead the country? Support #KaranSangwan Everyone knows who is uneducated So troll army understand that #KaranSangwan talk about whom #UninstallUnacadmy #UninstallUnacademy भक्तों को पागल समझा है क्या क्या वो नहीं जानते uneducated कोन है,1,AppStore,Unacademy,uninstallunacadmy are you really an educational institution when you fire someone for saying that education is necessary to lead the country support karansangwan everyone knows who is uneducated so troll army understand that karansangwan talk about whom uninstallunacadmy uninstallunacademy           uneducated  
very bad application always crashes and when you complain they say you can leave total fraud,2,AppStore,Unacademy,very bad application always crashes and when you complain they say you can leave total fraud
Spineless people,1,AppStore,Unacademy,spineless people
Don't waste your time in this. The developer is hypocrite.,1,AppStore,Unacademy,dont waste your time in this the developer is hypocrite
I’m uninstalling this app because it’s killing the freedom of speech in the free India.,1,AppStore,Unacademy,im uninstalling this app because its killing the freedom of speech in the free india
Please don’t use this. They took my money and didn’t provide complete lectures. Service is worst.,1,AppStore,Unacademy,please dont use this they took my money and didnt provide complete lectures service is worst
"The content is scattered and unorganised, confuse you more than helping out",1,AppStore,Unacademy,the content is scattered and unorganised confuse you more than helping out
"Not enough good educator for civil service ,rest of them are dramebazz",1,AppStore,Unacademy,not enough good educator for civil service rest of them are dramebazz
Not a good app its fires a good teacher in pressure of BJP,1,AppStore,Unacademy,not a good app its fires a good teacher in pressure of bjp
Uninstalled it…..,1,AppStore,Unacademy,uninstalled it
They are just another branch of BJP,1,AppStore,Unacademy,they are just another branch of bjp
Wrong Policies,1,AppStore,Unacademy,wrong policies
Nothing special u r fools,1,AppStore,Unacademy,nothing special u r fools
"One of the worst app
Guys pls dont install it 
They are fraud",1,AppStore,Unacademy,one of the worst appguys pls dont install it they are fraud
Completely useless app. YouTube has better courses than this app!,1,AppStore,Unacademy,completely useless app youtube has better courses than this app
"Bring back Karan Sangwan.
I watched the video which started this all. I don’t find it breaching any code of conduct.",1,AppStore,Unacademy,bring back karan sangwani watched the video which started this all i dont find it breaching any code of conduct
Cant login,1,AppStore,Unacademy,cant login
Shame on you,1,AppStore,Unacademy,shame on you
"Karan sir ko kyu nikaala !!
Uninstall",1,AppStore,Unacademy,karan sir ko kyu nikaala uninstall
Darr gye teacher ne ANPAD ka naam nahi liya par ANPAD samaj gya me hi hu  bca karne wala d u  se😂😂😂😂😂😂,1,AppStore,Unacademy,darr gye teacher ne anpad ka naam nahi liya par anpad samaj gya me hi hu  bca karne wala d u  se
nimo bhai ne bola hai uninstall kro toh karo,1,AppStore,Unacademy,nimo bhai ne bola hai uninstall kro toh karo
Read books and uninstall this app,1,AppStore,Unacademy,read books and uninstall this app
Karan sangwan,1,AppStore,Unacademy,karan sangwan
Please do not vote for uneducated politicians.,1,AppStore,Unacademy,please do not vote for uneducated politicians
😡😡😡Karan sangwan,1,AppStore,Unacademy,karan sangwan
You disqualify karan sangwan you have to be with that teacher. They cant say directly from indian leaders,1,AppStore,Unacademy,you disqualify karan sangwan you have to be with that teacher they cant say directly from indian leaders
"You fired a mind who spoke truth , you deserve the shut down of your business.",1,AppStore,Unacademy,you fired a mind who spoke truth  you deserve the shut down of your business
If you want to go for Judiciary preparation opt for Rahul’s IAS. This app is a scam.,1,AppStore,Unacademy,if you want to go for judiciary preparation opt for rahuls ias this app is a scam
"I installed and uninstalled. They support facists agenda. Can’t even support an employee who said something as simple as don’t vote for uneducated. It is run by spineless, such learning platform can do no good.",1,AppStore,Unacademy,i installed and uninstalled they support facists agenda cant even support an employee who said something as simple as dont vote for uneducated it is run by spineless such learning platform can do no good
Really disappointed realising how biased there core belief is. As an education platform they should not be in a right  or left wing propaganda. Really really sad we have to see this day,1,AppStore,Unacademy,really disappointed realising how biased there core belief is as an education platform they should not be in a right  or left wing propaganda really really sad we have to see this day
It’s unfortunate that this learning platform bent down to the hate politics and fired a capable teacher. Shame on you for not standing up for what’s right,1,AppStore,Unacademy,its unfortunate that this learning platform bent down to the hate politics and fired a capable teacher shame on you for not standing up for whats right
This is for firing your teacher who asked his pupils to vote for an educated leader. Before you teach something - learn to stand up for what is right.,1,AppStore,Unacademy,this is for firing your teacher who asked his pupils to vote for an educated leader before you teach something  learn to stand up for what is right
Vote for educated politicians.,1,AppStore,Unacademy,vote for educated politicians
1 star for removing faculty who said truth about current political situation . Shame on you for such an act !,1,AppStore,Unacademy, star for removing faculty who said truth about current political situation  shame on you for such an act 
Need some improvements,1,AppStore,Unacademy,need some improvements
Support uneducated people…. Can they give education?,1,AppStore,Unacademy,support uneducated people can they give education
I am giving 1 star as this app work under pressure of uneducated leaders,1,AppStore,Unacademy,i am giving  star as this app work under pressure of uneducated leaders
I am quitting because of Karan sir,1,AppStore,Unacademy,i am quitting because of karan sir
They are looting money from innocent students and discriminating.Firing teachers who are good in teaching.,1,AppStore,Unacademy,they are looting money from innocent students and discriminatingfiring teachers who are good in teaching
"Educational App don’t know Ethics , I wish i could give you more then 1 star .",1,AppStore,Unacademy,educational app dont know ethics  i wish i could give you more then  star 
Shouldn’t have firemd Sangwan sir,1,AppStore,Unacademy,shouldnt have firemd sangwan sir
"Worst learning app, only concentrate on money making",1,AppStore,Unacademy,worst learning app only concentrate on money making
Support Karan Sangwan. I am uninstalling the app because you are working against the freedom of speech. You have done a shameful thing by removing a teacher.,1,AppStore,Unacademy,support karan sangwan i am uninstalling the app because you are working against the freedom of speech you have done a shameful thing by removing a teacher
Have best teachers who focus on high quality content. Quickly fired a useless leftist crap posing as teacher 😂👍,5,AppStore,Unacademy,have best teachers who focus on high quality content quickly fired a useless leftist crap posing as teacher 
A little bit costly 🤑,1,AppStore,Unacademy,a little bit costly 
Don’t sign up for any of their courses. It’s a fraud company,1,AppStore,Unacademy,dont sign up for any of their courses its a fraud company
Unacademy promoting uneducated leaders in India,1,AppStore,Unacademy,unacademy promoting uneducated leaders in india
Sangwan sir should be reinstated,1,AppStore,Unacademy,sangwan sir should be reinstated
This is worst education app and just on the path of Byju’s,1,AppStore,Unacademy,this is worst education app and just on the path of byjus
A platform for education takes action against someone who stood for education. The irony!,1,AppStore,Unacademy,a platform for education takes action against someone who stood for education the irony
"You are coward, biased and fascist. You people do not believe in freedom of expression. Worst company",1,AppStore,Unacademy,you are coward biased and fascist you people do not believe in freedom of expression worst company
Worst app spreading propaganda on behalf of BJP !!,1,AppStore,Unacademy,worst app spreading propaganda on behalf of bjp 
"Karan Sangwan's reply to BJP and Unacademy. 

What a brave and courageous man 🔥

Absolutely Inspiring.",1,AppStore,Unacademy,karan sangwans reply to bjp and unacademy what a brave and courageous man absolutely inspiring
Content is old,1,AppStore,Unacademy,content is old
Fraud app !,1,AppStore,Unacademy,fraud app 
"You removed a teacher on your platform just because he asked to vote someone who is educated without naming anyone.

Show some spine and reinstate him immediately also stand against the unwanted pressure. Grow up.",1,AppStore,Unacademy,you removed a teacher on your platform just because he asked to vote someone who is educated without naming anyoneshow some spine and reinstate him immediately also stand against the unwanted pressure grow up
Why did the platform did not support karan Sangwan sir and fired him ? The platform which bow down to fascists have no place in my phone. I will recommend all my near and dear ones to uninstall the app.,1,AppStore,Unacademy,why did the platform did not support karan sangwan sir and fired him  the platform which bow down to fascists have no place in my phone i will recommend all my near and dear ones to uninstall the app
Business should not be biased and support “uneducated leaders” And fire educated teachers,1,AppStore,Unacademy,business should not be biased and support uneducated leaders and fire educated teachers
"Wish there was a zero star option. A teacher can’t even tell his students to choose a literate and educated leader? You were supposed to be ‘un’academy, now there’s no difference between you and other thousand academies out there.",1,AppStore,Unacademy,wish there was a zero star option a teacher cant even tell his students to choose a literate and educated leader you were supposed to be unacademy now theres no difference between you and other thousand academies out there
Your capitalist mindset will eat you up. Support for Karan Sangwan sir.,1,AppStore,Unacademy,your capitalist mindset will eat you up support for karan sangwan sir
Justice for Karan Sangwan,1,AppStore,Unacademy,justice for karan sangwan
I will never use this application…I support Karan Sangwan,1,AppStore,Unacademy,i will never use this applicationi support karan sangwan
There is a back button issue in the app for iPhone X. Once I enter the app and access a teacher I can't get back as the back button at the top of the screen in the app is not responding,1,AppStore,Unacademy,there is a back button issue in the app for iphone x once i enter the app and access a teacher i cant get back as the back button at the top of the screen in the app is not responding
It’s hire so called teachers who has zero knowledge toward their subject and have experience in spreading anti India and anti Hindu activities,1,AppStore,Unacademy,its hire so called teachers who has zero knowledge toward their subject and have experience in spreading anti india and anti hindu activities
"Worst experience of this aap in ios. I am watching in my ipad ,it always freezes . Im not able to do my classes properly. Please fix this problem",2,AppStore,Unacademy,worst experience of this aap in ios i am watching in my ipad it always freezes  im not able to do my classes properly please fix this problem
Worst Software.  Video stops itself when watching class and never starts again at that time need to wait for long time to continue that video. Very poor software,1,AppStore,Unacademy,worst software  video stops itself when watching class and never starts again at that time need to wait for long time to continue that video very poor software
No doubt at such a affordable rates their content is worth it but they must bring update to make the app more smooth are most of the time the recorded videos are lagging,2,AppStore,Unacademy,no doubt at such a affordable rates their content is worth it but they must bring update to make the app more smooth are most of the time the recorded videos are lagging
I never knew I’d be wasting my money while getting the subscription.It’s literally the worst app and the customer care team is really really bad and arrogant. Despite getting the app in march itself I still haven’t received my notes which I was promised. I tried contacting the support team but no response. After so long i am tired. I hope this app gets banned as they are just taking money and offering nothing in return,1,AppStore,Unacademy,i never knew id be wasting my money while getting the subscriptionits literally the worst app and the customer care team is really really bad and arrogant despite getting the app in march itself i still havent received my notes which i was promised i tried contacting the support team but no response after so long i am tired i hope this app gets banned as they are just taking money and offering nothing in return
Some classes doesn’t even play on IOS Unacademy app,1,AppStore,Unacademy,some classes doesnt even play on ios unacademy app
"Zero star application. The educators are great. Their teachings are great. But the rest of the whole services is worse than anything imaginable. Third class feedback system, Your queries & complains mean nothing to them. I got scammed…& now they are not answering my genuine concerns. Teachers are good, the rest everything - notes, pdf downloads, feedback & complains everything worst level.",1,AppStore,Unacademy,zero star application the educators are great their teachings are great but the rest of the whole services is worse than anything imaginable third class feedback system your queries  complains mean nothing to them i got scammed now they are not answering my genuine concerns teachers are good the rest everything  notes pdf downloads feedback  complains everything worst level
Worst app only looting us👎,1,AppStore,Unacademy,worst app only looting us
Hello iam using Unacademy so they people calling continuously for subscriptions don’t do this,1,AppStore,Unacademy,hello iam using unacademy so they people calling continuously for subscriptions dont do this
Bakwass app haiii pagal bnate hai ek bar subscription dene ke bad phn ni uthate na inki pdf download hoti na notes provide krwate yee iconic subcription lene ke bad bhi,1,AppStore,Unacademy,bakwass app haiii pagal bnate hai ek bar subscription dene ke bad phn ni uthate na inki pdf download hoti na notes provide krwate yee iconic subcription lene ke bad bhi
"Whenever any notifications comes up or we switch app ,the next time video plays for like a minute and screen dims itself video stops playing And closes the app. It is longest running inconvenience in apple device. Please sort it out.",3,AppStore,Unacademy,whenever any notifications comes up or we switch app the next time video plays for like a minute and screen dims itself video stops playing and closes the app it is longest running inconvenience in apple device please sort it out
Before purchasing they were calling frequently but after purchasing I have a issue on downloading pdf and when I call they are not responding at all … Think twice before purchasing,1,AppStore,Unacademy,before purchasing they were calling frequently but after purchasing i have a issue on downloading pdf and when i call they are not responding at all  think twice before purchasing
What a idiotic app developers.. the app keeps crashing and the video pauses while the audio continues.. very much time waste.. waste of money to buy subscription.. highly regret,1,AppStore,Unacademy,what a idiotic app developers the app keeps crashing and the video pauses while the audio continues very much time waste waste of money to buy subscription highly regret
Please provide download option and also class notes are not available,3,AppStore,Unacademy,please provide download option and also class notes are not available
I am unable to fast forward videos and video frames are freezing in between.,1,AppStore,Unacademy,i am unable to fast forward videos and video frames are freezing in between
Very slow and glitchy application takes a lot of time to load the videos and doesn’t even respond at most of the times.,1,AppStore,Unacademy,very slow and glitchy application takes a lot of time to load the videos and doesnt even respond at most of the times
Take this app to the level of your chrome browser experience,1,AppStore,Unacademy,take this app to the level of your chrome browser experience
Downloaded now,5,AppStore,Unacademy,downloaded now
To sell subscriptions they told me that they will provide me and other students too complete notes before classes will start but after a week they stopped responding to my calls and mails about it they completely ignored they are not providing any notes in any of the subscriptions if they say notes they mean normal basic PPT from which teachers teaches nothing else …..,2,AppStore,Unacademy,to sell subscriptions they told me that they will provide me and other students too complete notes before classes will start but after a week they stopped responding to my calls and mails about it they completely ignored they are not providing any notes in any of the subscriptions if they say notes they mean normal basic ppt from which teachers teaches nothing else 
ग़लत बता कर पेमेंट करवाया इन्होंने,1,AppStore,Unacademy,     
"Unacdemy team call me when i open their app, and then explain me about courses that they will provide material in both languages and batch is started in hindi medium but teacher said use your dictionary 😂😂😂, this was very funny, totally waste of money for hindi medium student, they claim that having india’s so called best teacher but i dont think so.",1,AppStore,Unacademy,unacdemy team call me when i open their app and then explain me about courses that they will provide material in both languages and batch is started in hindi medium but teacher said use your dictionary  this was very funny totally waste of money for hindi medium student they claim that having indias so called best teacher but i dont think so
They will only arrange a call and assistance for Sales dept…not for resolving ur queries and doubts…the sales team is not there for you after you pay fees…then you will be on your own…which course to enroll,1,AppStore,Unacademy,they will only arrange a call and assistance for sales deptnot for resolving ur queries and doubtsthe sales team is not there for you after you pay feesthen you will be on your ownwhich course to enroll
Unacademy is not at all good for a middle class student who cannot afford plus or iconic they suggest to take single batch by promising to cover whole syllabus from start and then after joining the batch they say pehle hi do chp hogaye hai naye baccho ko bata raha hu and dont even give access to those lectures cause you have just taken batch they say please take plus subscription and the teachers are also not teachers with full enthusiasm cause they just come with ppt and turn slides dont even make proper notes or provide pdf they have very bad faculty nd facilities i was in nurturo pro batch and I suggest no one to take it and secondly they dont even give refund isse behtar padhai youtube pe hojayegi aapki,1,AppStore,Unacademy,unacademy is not at all good for a middle class student who cannot afford plus or iconic they suggest to take single batch by promising to cover whole syllabus from start and then after joining the batch they say pehle hi do chp hogaye hai naye baccho ko bata raha hu and dont even give access to those lectures cause you have just taken batch they say please take plus subscription and the teachers are also not teachers with full enthusiasm cause they just come with ppt and turn slides dont even make proper notes or provide pdf they have very bad faculty nd facilities i was in nurturo pro batch and i suggest no one to take it and secondly they dont even give refund isse behtar padhai youtube pe hojayegi aapki
"Lagging and frame drops with audio-visual desync issues, on iPad Pro M2.",2,AppStore,Unacademy,lagging and frame drops with audiovisual desync issues on ipad pro m
Took my money as a subscription. Classes never started.  There is no way to contact them except email which they will never reply to,1,AppStore,Unacademy,took my money as a subscription classes never started  there is no way to contact them except email which they will never reply to
This is worst app for mppsc … teachers are not interested with interacting students  and they do not provide proper notes of mp topic…. Don’t waste your money guys,1,AppStore,Unacademy,this is worst app for mppsc  teachers are not interested with interacting students  and they do not provide proper notes of mp topic dont waste your money guys
It is a wonderful app for preperation for any exams at free of costs and it really such premium and organized. All the materials are available in this app for children and collage and any exam preparation student we can give 5 out of 5 for the app and for its developer I am really feeling good because it provides extra cources in low price of cost,5,AppStore,Vedantu,it is a wonderful app for preperation for any exams at free of costs and it really such premium and organized all the materials are available in this app for children and collage and any exam preparation student we can give  out of  for the app and for its developer i am really feeling good because it provides extra cources in low price of cost
