content,score,source,app,clean_review
"This is a fraud app. One of my friend subscribed it but she got cheated. the representative of this platform misguides her. they told that live class will be in Hindi but notes are in English. however, after the subscription she couldn't able to download English notes. Whn she has contacted with the representatives they told unacademy will not provide any note in English version.",1,PlayStore,Unacademy,this is a fraud app one of my friend subscribed it but she got cheated the representative of this platform misguides her they told that live class will be in hindi but notes are in english however after the subscription she couldnt able to download english notes whn she has contacted with the representatives they told unacademy will not provide any note in english version
actually the app is not working well ❤️‍🩹,1,PlayStore,Unacademy,actually the app is not working well 
Worst app doesn't working.,1,PlayStore,Unacademy,worst app doesnt working
thik hai or achcha hai,5,PlayStore,Unacademy,thik hai or achcha hai
it's so helpful 💯👌thank you good job 🙏🙏,5,PlayStore,Unacademy,its so helpful thank you good job 
good 👍👍👍👍👍👍,5,PlayStore,Unacademy,good 
good 👍 teacher love you,5,PlayStore,Unacademy,good  teacher love you
"ICONIC MEMBERSHIP IS TOTALLY USELESS. and no personal attention is given , any mentor is not active and support system just talk don't work at all.",1,PlayStore,Unacademy,iconic membership is totally useless and no personal attention is given  any mentor is not active and support system just talk dont work at all
The interface is very bad,1,PlayStore,Unacademy,the interface is very bad
Teachers Best but App interface waste of time My request to App developer & Coaching ower Please improve your App UI/UX other wise Company Close Just like byju's. I hope you improve your app interface,3,PlayStore,Unacademy,teachers best but app interface waste of time my request to app developer  coaching ower please improve your app uiux other wise company close just like byjus i hope you improve your app interface
too much frustrated they call you continuously used different numbers and you said no after they understand and wastes your energy I'm too much stressed because they irritated or continue calling me 😭😭 please Stop calling I'm already in bad condition,1,PlayStore,Unacademy,too much frustrated they call you continuously used different numbers and you said no after they understand and wastes your energy im too much stressed because they irritated or continue calling me  please stop calling im already in bad condition
wastage of time,1,PlayStore,Unacademy,wastage of time
very very poor service I would request not to join this . they don't listen to your problems even after being a huge amount. in the test always the questions come from out of syllabus.,1,PlayStore,Unacademy,very very poor service i would request not to join this  they dont listen to your problems even after being a huge amount in the test always the questions come from out of syllabus
top class faculty with most helpful staff,5,PlayStore,Unacademy,top class faculty with most helpful staff
"psir,my favourite subject but i am confused in selction of my optional subject, i chat with my senoir then i opt it.",4,PlayStore,Unacademy,psirmy favourite subject but i am confused in selction of my optional subject i chat with my senoir then i opt it
any platform of learning is best so this platforms is also best,5,PlayStore,Unacademy,any platform of learning is best so this platforms is also best
very bad experience in this class Hadapsar Centre are very bad don't understand the situation of parents i paid 31000 and he not refund my money and say company are not refund you and go and complete in police station we don't care not contact us not recieved a call,1,PlayStore,Unacademy,very bad experience in this class hadapsar centre are very bad dont understand the situation of parents i paid  and he not refund my money and say company are not refund you and go and complete in police station we dont care not contact us not recieved a call
"Everything good except english biology teacher-Her focus level is zero lux—we’re in the dark more than chloroplasts at midnight, Every time she explains something, the mitochondria lose their will to be the powerhouse💀",1,PlayStore,Unacademy,everything good except english biology teacherher focus level is zero luxwere in the dark more than chloroplasts at midnight every time she explains something the mitochondria lose their will to be the powerhouse
this app isn't work well. and my studies are on hold cause of this.,1,PlayStore,Unacademy,this app isnt work well and my studies are on hold cause of this
nice app but teachers don't teach infront of a black board they share a screen and teach which is very distracting sone time thir networks doesn't work so it causes prblms i joined it for my class 11 and only commerce and English teacher was nice accounts teacher makes the study vey confusing and the economic mam is also very bad at explaining I'm regretting of buying a 1 year plan total waste of money I will definitely not buy it in my class 12,1,PlayStore,Unacademy,nice app but teachers dont teach infront of a black board they share a screen and teach which is very distracting sone time thir networks doesnt work so it causes prblms i joined it for my class  and only commerce and english teacher was nice accounts teacher makes the study vey confusing and the economic mam is also very bad at explaining im regretting of buying a  year plan total waste of money i will definitely not buy it in my class 
best teacher,5,PlayStore,Unacademy,best teacher
nice education nice educators,5,PlayStore,Unacademy,nice education nice educators
loss of 45000 money so be careful no use teacher are just faltu,1,PlayStore,Unacademy,loss of  money so be careful no use teacher are just faltu
Nice educator,3,PlayStore,Unacademy,nice educator
"The best app for JEE preparation I'm writing it one star because of the team which is not responding because of some problems I'm facing.after the classes switched to boards i am not able to live lectures on my iPad,but phone(android) i am able to attend.There's is no problem my end because the device is brand new and my wifi speed is at least more than 30mbps.so please help with this query",1,PlayStore,Unacademy,the best app for jee preparation im writing it one star because of the team which is not responding because of some problems im facingafter the classes switched to boards i am not able to live lectures on my ipadbut phoneandroid i am able to attendtheres is no problem my end because the device is brand new and my wifi speed is at least more than mbpsso please help with this query
"worst app ever, subscription ke liye sahi se guide nhi karte , mujhe plus kaa subscription Lena the aur yeh logo ne mujhe normal batch ka subscription dilwa diya ,with same price,ab mai kya karu , mujhe Insaaf chahiye",1,PlayStore,Unacademy,worst app ever subscription ke liye sahi se guide nhi karte  mujhe plus kaa subscription lena the aur yeh logo ne mujhe normal batch ka subscription dilwa diya with same priceab mai kya karu  mujhe insaaf chahiye
Good application for the students 😃,5,PlayStore,Unacademy,good application for the students 
good inner me atmkbfjg🙏🤩🤩👌👌👌,5,PlayStore,Unacademy,good inner me atmkbfjg
"hi , unacademy pls don't spam if I just login on your app. , and follow some corporate ethics and don't disturb aspirants , why do you call me daily",1,PlayStore,Unacademy,hi  unacademy pls dont spam if i just login on your app  and follow some corporate ethics and dont disturb aspirants  why do you call me daily
Best learning app for upsc exam.,5,PlayStore,Unacademy,best learning app for upsc exam
very bad app not working on my tablet,1,PlayStore,Unacademy,very bad app not working on my tablet
very good learning aap thanks 👍,5,PlayStore,Unacademy,very good learning aap thanks 
very rude and irresponsible behaviour of helpline care,1,PlayStore,Unacademy,very rude and irresponsible behaviour of helpline care
Nice Plateform,5,PlayStore,Unacademy,nice plateform
"The tech team should be fired. No doubt, Unacademy has great teachers, but there are tons of tech issues during live classes. Please do not waste your time and money on Unacademy courses. The app is useless. I wish I could rate it even lower. Now I understand why there are so many one-star ratings. All I can say to my juniors is please do not get any kind of subscription from Unacademy ,go for other education apps. I'm 100% sure that every time you open Unacademy, you will find it even worse.",1,PlayStore,Unacademy,the tech team should be fired no doubt unacademy has great teachers but there are tons of tech issues during live classes please do not waste your time and money on unacademy courses the app is useless i wish i could rate it even lower now i understand why there are so many onestar ratings all i can say to my juniors is please do not get any kind of subscription from unacademy go for other education apps im  sure that every time you open unacademy you will find it even worse
yes yes good,5,PlayStore,Unacademy,yes yes good
totally worst experience.....educators are best but the app is worst one they call you constantly to purchase the batch but as soon as you purchase it evn it's not show they just give you one response to wait thn after constant txt from students side they don't reply nor they help what to do now ....,1,PlayStore,Unacademy,totally worst experienceeducators are best but the app is worst one they call you constantly to purchase the batch but as soon as you purchase it evn its not show they just give you one response to wait thn after constant txt from students side they dont reply nor they help what to do now 
why can't I connect to the free classes??,1,PlayStore,Unacademy,why cant i connect to the free classes
I can't connect to 9:05 pm quiz...,1,PlayStore,Unacademy,i cant connect to  pm quiz
Best platform to crack exam,5,PlayStore,Unacademy,best platform to crack exam
good platform 👍,5,PlayStore,Unacademy,good platform 
waste app 🙄,1,PlayStore,Unacademy,waste app 
"hello guys if you think this app is so helpful then you are wrong specially I told NDA subscription, there are no any faculty of math,geography etc, and app feature are very bad first of all you have to spend 1 month for Understanding what are going on with you you have to join coursepage and if you don't know how to join corse page then you find where is class guys I told you only that never and never buy the Unacademy subscription",1,PlayStore,Unacademy,hello guys if you think this app is so helpful then you are wrong specially i told nda subscription there are no any faculty of mathgeography etc and app feature are very bad first of all you have to spend  month for understanding what are going on with you you have to join coursepage and if you dont know how to join corse page then you find where is class guys i told you only that never and never buy the unacademy subscription
"When I had to purchase the class they called me again and again and one of its team members told me that if I would get the subscription of 6 months I would get 3 months extended months along with 6 months and it will be credited after 45 days of purchase. But as I wouldn't get the extended months I called them again, they asked for 24 hours and then blocked my number. They made me wander to the app to email only. The worst service they hold. Poor experience.",1,PlayStore,Unacademy,when i had to purchase the class they called me again and again and one of its team members told me that if i would get the subscription of  months i would get  months extended months along with  months and it will be credited after  days of purchase but as i wouldnt get the extended months i called them again they asked for  hours and then blocked my number they made me wander to the app to email only the worst service they hold poor experience
good classes especially in english,5,PlayStore,Unacademy,good classes especially in english
excellent n amazing teacher S.G. Sir,5,PlayStore,Unacademy,excellent n amazing teacher sg sir
bad experience,3,PlayStore,Unacademy,bad experience
it was great 👍🙏👏,5,PlayStore,Unacademy,it was great 
playstore ko paisa khila ke rakha h app dusra app search kro ye aa jata h,1,PlayStore,Unacademy,playstore ko paisa khila ke rakha h app dusra app search kro ye aa jata h
bakwas hai,1,PlayStore,Unacademy,bakwas hai
apse Acha teacher koi nhi sir thanku 😊 🙏,5,PlayStore,Unacademy,apse acha teacher koi nhi sir thanku  
Worst institute ever they lit.changed the best teachers no consistency lack of teachers . 4months left and they lit. Changed the head teacher of our jee section In gwalior center. For them study is just a business,4,PlayStore,Unacademy,worst institute ever they litchanged the best teachers no consistency lack of teachers  months left and they lit changed the head teacher of our jee section in gwalior center for them study is just a business
I like to use this app as it has good courses and top educators for learning......but after a week or two of using this app it started to be slow and sometimes also use to hang ...which usually wastes my time and it also frustates a lot! So please do something to use this app smoothly,2,PlayStore,Unacademy,i like to use this app as it has good courses and top educators for learningbut after a week or two of using this app it started to be slow and sometimes also use to hang which usually wastes my time and it also frustates a lot so please do something to use this app smoothly
for learning,2,PlayStore,Unacademy,for learning
the best ias preperation study app,5,PlayStore,Unacademy,the best ias preperation study app
best classes,5,PlayStore,Unacademy,best classes
nice app 😍😍🥰😍😍🥰🥰🥰,4,PlayStore,Unacademy,nice app 
very useful for better study 📝🗒️📈,3,PlayStore,Unacademy,very useful for better study 
all teachers are mind-blowing,4,PlayStore,Unacademy,all teachers are mindblowing
worst part of this app is they are calling continuously for their offers.. how can any one use their free access with this type of inconvenience.. so disturbing,1,PlayStore,Unacademy,worst part of this app is they are calling continuously for their offers how can any one use their free access with this type of inconvenience so disturbing
quality of Educators,5,PlayStore,Unacademy,quality of educators
very good learning platform,5,PlayStore,Unacademy,very good learning platform
Worst application ever. Paid marketing karte hai for views and subscription.,1,PlayStore,Unacademy,worst application ever paid marketing karte hai for views and subscription
east or west PW is the best!,1,PlayStore,Unacademy,east or west pw is the best
best online learning Application for judiciary. N number of educators give you liberty of learning from the best one And for me best is one and only VISHAL SINGH THAKUR SIR . BEST APPLICATION AND BEST EDUCATOR,5,PlayStore,Unacademy,best online learning application for judiciary n number of educators give you liberty of learning from the best one and for me best is one and only vishal singh thakur sir  best application and best educator
बिलकुल बेकार 😔app है...,1,PlayStore,Unacademy,  app 
Updated version is not working properly.....whole day I tried to open it but I couldn't. year 2022 now it is very good 2025,4,PlayStore,Unacademy,updated version is not working properlywhole day i tried to open it but i couldnt year  now it is very good 
Unacademy is an amazing learning platform with wide range of educators. Vishal sir/ our bhaiya is the best educator not just at unacademy but in the entire legal fraternity. The excellent teacher for all the subjects. I have personally grown under the guidance of Vishal sir. Thank you bhaiya for your unwavering efforts.,5,PlayStore,Unacademy,unacademy is an amazing learning platform with wide range of educators vishal sir our bhaiya is the best educator not just at unacademy but in the entire legal fraternity the excellent teacher for all the subjects i have personally grown under the guidance of vishal sir thank you bhaiya for your unwavering efforts
some classes are not showing still classes problem study is not going on properly do something,2,PlayStore,Unacademy,some classes are not showing still classes problem study is not going on properly do something
best learning app,4,PlayStore,Unacademy,best learning app
they're calling me again again and I unsubscribed from them still now they're calling me again again don't do this it irritating me don't u have any common sense at all don't repeat this again,1,PlayStore,Unacademy,theyre calling me again again and i unsubscribed from them still now theyre calling me again again dont do this it irritating me dont u have any common sense at all dont repeat this again
maja nahi aata is app mai study mai bhi koi khas helpfull nahi hai isiliye mai dusri coching sai online course lekar study karata hu,1,PlayStore,Unacademy,maja nahi aata is app mai study mai bhi koi khas helpfull nahi hai isiliye mai dusri coching sai online course lekar study karata hu
unnecessary call always,1,PlayStore,Unacademy,unnecessary call always
great experience in this app 😍😍,5,PlayStore,Unacademy,great experience in this app 
This is very good online education platform of India,5,PlayStore,Unacademy,this is very good online education platform of india
this app sucks pls dont downlonad it they will constantly harass you by callimg 10 to 15 times in a day and tell you to buy their course,1,PlayStore,Unacademy,this app sucks pls dont downlonad it they will constantly harass you by callimg  to  times in a day and tell you to buy their course
didn't access the previous courses . validity still to the next year 2026,1,PlayStore,Unacademy,didnt access the previous courses  validity still to the next year 
my first attempt I am best I can do it next attempt,5,PlayStore,Unacademy,my first attempt i am best i can do it next attempt
very good educators,5,PlayStore,Unacademy,very good educators
"enrolled for UPSC batch, the mobile application is very bad. it has lot of technical glitches. also if you complaint about the same to the technical staff at the center they act very unresponsive. They have no accountability towards solving your problems. They just ignore you or behave weirdly whenever you tell them about the issue.",1,PlayStore,Unacademy,enrolled for upsc batch the mobile application is very bad it has lot of technical glitches also if you complaint about the same to the technical staff at the center they act very unresponsive they have no accountability towards solving your problems they just ignore you or behave weirdly whenever you tell them about the issue
best platform for study 😁,5,PlayStore,Unacademy,best platform for study 
excellent 👍,5,PlayStore,Unacademy,excellent 
quality education provided in this platform,4,PlayStore,Unacademy,quality education provided in this platform
they fooled me their marketing person fooled me took money and now not responding written n number of emails to unacademy they are also not responding no they have not given any proper response only same response don't fool around,1,PlayStore,Unacademy,they fooled me their marketing person fooled me took money and now not responding written n number of emails to unacademy they are also not responding no they have not given any proper response only same response dont fool around
good aap solve eran,5,PlayStore,Unacademy,good aap solve eran
worst education app in india.....I purchased guarantee batch for neet 2026... but the batch is discontinued.....and our money is not refunded till now.....I suggest..... don't go with academy...,1,PlayStore,Unacademy,worst education app in indiai purchased guarantee batch for neet  but the batch is discontinuedand our money is not refunded till nowi suggest dont go with academy
I feel cheated. The Iconic pack which I purchased at 12.5k is actually offering only 8.5k. Fees should be same for all students at all times Iconic pack is useless. some teachers teach irregular topic.,1,PlayStore,Unacademy,i feel cheated the iconic pack which i purchased at k is actually offering only k fees should be same for all students at all times iconic pack is useless some teachers teach irregular topic
very very porr aap,1,PlayStore,Unacademy,very very porr aap
"The educators are very good but the app is very slow ,and the people of unacademy call us at the time of subscription after that they forgot to call you back when you need their help for educators only i give 3 stars",3,PlayStore,Unacademy,the educators are very good but the app is very slow and the people of unacademy call us at the time of subscription after that they forgot to call you back when you need their help for educators only i give  stars
"when I login with my phone number, continue they are calling. please do not call again and again . it makes someone irritative and creates distrubance . I got moral that you should not give ur mobile number to any education application continue calls I'm receiving from morning I request to stop calls else I will block every unknown calls. it is making me more irritative",1,PlayStore,Unacademy,when i login with my phone number continue they are calling please do not call again and again  it makes someone irritative and creates distrubance  i got moral that you should not give ur mobile number to any education application continue calls im receiving from morning i request to stop calls else i will block every unknown calls it is making me more irritative
bakar institute hai sab say mai unacademy koy in kai institute say nai padha,1,PlayStore,Unacademy,bakar institute hai sab say mai unacademy koy in kai institute say nai padha
"It is very good learning platform and their teachers are literally wow. They teach in a very clear and simple way even though hard and difficult chapters are become so easy and the best part is all teachers took doubt class , discussion class, practice class , extra class infact pajama class. It is just an amazing app . Thanks unacademy for making learning so easy",5,PlayStore,Unacademy,it is very good learning platform and their teachers are literally wow they teach in a very clear and simple way even though hard and difficult chapters are become so easy and the best part is all teachers took doubt class  discussion class practice class  extra class infact pajama class it is just an amazing app  thanks unacademy for making learning so easy
nice experience,5,PlayStore,Unacademy,nice experience
good experience,5,PlayStore,Unacademy,good experience
Best learning app in India with best educators.,5,PlayStore,Unacademy,best learning app in india with best educators
"it is always hindi we students as a non-hindi speakers can't understand anything. if there is a topic in need and it is in hindi ,i can't find a english version .",1,PlayStore,Unacademy,it is always hindi we students as a nonhindi speakers cant understand anything if there is a topic in need and it is in hindi i cant find a english version 
This is the worst app I have ever seen,1,PlayStore,Unacademy,this is the worst app i have ever seen
"it is the best online portal to learn any couse provided by the Unacademy's faculty..... if you desire to achieve success in competitive exams, you should join and feel the difference.",5,PlayStore,Unacademy,it is the best online portal to learn any couse provided by the unacademys faculty if you desire to achieve success in competitive exams you should join and feel the difference
On this platform.. I have experience of 4 yrs.. and trust me it the best in my view.. This is not a platform ... it has became an emotion for me.. it transformed me from an average to topper... it helped to find my potential... what I say about the teachers they are the true mentors.. not only online now I am pursuing unacademy offline.. and trust me.. it feels like heaven if u are reading it.. I would suggest to once try it..,5,PlayStore,Unacademy,on this platform i have experience of  yrs and trust me it the best in my view this is not a platform  it has became an emotion for me it transformed me from an average to topper it helped to find my potential what i say about the teachers they are the true mentors not only online now i am pursuing unacademy offline and trust me it feels like heaven if u are reading it i would suggest to once try it
no class regularly educator have server issue in every week 1)syllabus is to much slow prompting batches and marjing in new batch and revising again and again please fix these worst problem #please surve justice 2)taking classes in smart board is laging in every second,1,PlayStore,Unacademy,no class regularly educator have server issue in every week syllabus is to much slow prompting batches and marjing in new batch and revising again and again please fix these worst problem please surve justice taking classes in smart board is laging in every second
Please bring back all removed educators back mainly CA Bahubali team as I and my many friends have subscribed because of their teaching style and we are fan of those teachers if not refund our subscription money,5,PlayStore,Unacademy,please bring back all removed educators back mainly ca bahubali team as i and my many friends have subscribed because of their teaching style and we are fan of those teachers if not refund our subscription money
can't even find proper notes and dpp,3,PlayStore,Unacademy,cant even find proper notes and dpp
